{
  "$schema": "../../schemas/civilization-spec.schema.json",
  "schemaVersion": 1,
  "id": "canopy_accord",
  "seed": "civ-canopy-031",
  "name": "冠层协约文明",
  "description": "由多个林冠聚落共同维持资源循环和公共知识的协约文明。",
  "license": "GPL-3.0-or-later",
  "origin": {
    "biome": "canopy_basin",
    "founderPopulation": 96,
    "startingEra": "origin",
    "resources": 180,
    "knowledge": 16,
    "ecology": 96,
    "cohesion": 84
  },
  "values": {
    "knowledge": 68,
    "ecology": 92,
    "expansion": 18,
    "militarism": 4,
    "collectivism": 88
  },
  "autonomy": {
    "mode": "manual",
    "strategyInterval": 60,
    "allowedIntents": ["research_focus", "ecology_policy", "cohesion_policy"]
  },
  "stopConditions": {
    "maxTicks": 1000,
    "haltOnCollapse": true
  }
}
